{
  "schema_version": "slot-alignment.alignment-report-manifest.v6",
  "report_contract_version": "slot-alignment.report.v6",
  "task_id": "<task-id>",
  "source_files": [
    {"path": "artifacts/01-input-profile/input_manifest.json", "sha256": "<sha256>"},
    {"path": "artifacts/02-metric-matching/metric_contract.json", "sha256": "<sha256>"},
    {"path": "artifacts/04-alignment/formal_result.json", "sha256": "<sha256>"}
  ],
  "report_file": {"path": "交付物/报告文档/对齐报告.md", "sha256": "<sha256>"},
  "placeholders_resolved": true,
  "generated_at": "<ISO-8601>"
}
